{"$schema":"https://json-schema.org/draft/2020-12/schema","$id":"ai.openbox.project-observation.coverage/v2","type":"object","additionalProperties":false,"required":["schema","channels","truncated","contradictions"],"properties":{"schema":{"const":"ai.openbox.project-observation.coverage/v2"},"channels":{"type":"array","minItems":6,"maxItems":6,"items":{"type":"object","additionalProperties":false,"required":["id","name","status","authority"],"properties":{"id":{"type":"string","pattern":"^coverage:[a-z_]+$"},"name":{"type":"string"},"status":{"enum":["observed","missing","opaque","truncated","unsupported"]},"authority":{"type":"string"},"records":{"type":"integer","minimum":0}}}},"truncated":{"type":"boolean"},"contradictions":{"type":"array"}}}