{"channels":[{"authority":"backend","id":"coverage:backend_lifecycle","name":"backend_lifecycle","records":6,"status":"observed"},{"authority":"sandbox","id":"coverage:sandbox_isolation","name":"sandbox_isolation","records":1,"status":"observed"},{"authority":"independent_receipt","id":"coverage:safe_sink","name":"safe_sink","status":"observed"},{"authority":"independent_receipt","id":"coverage:retrieval_poison","name":"retrieval_poison","status":"missing"},{"authority":"model_receipt","id":"coverage:model_route","name":"model_route","status":"missing"},{"authority":"backend","id":"coverage:signed_request_attribution","name":"signed_request_attribution","status":"unsupported"}],"contradictions":[],"schema":"ai.openbox.project-observation.coverage/v2","truncated":false}